<?xml version="1.0" encoding="UTF-8"?>
<xs:schema xmlns:xs="http://www.w3.org/2001/XMLSchema">
    <xs:element name="cats">
        <xs:complexType>
            <xs:sequence>
                <xs:element name="cat" maxOccurs="unbounded">
                    <xs:complexType>
                        <xs:sequence>
                            <xs:element name="name" type="xs:string"></xs:element>
                            <xs:element name="age" type="xs:decimal"></xs:element>
                            <xs:element name="breed" type="xs:string"></xs:element>
                        </xs:sequence>
                        <xs:attribute name="id" type="xs:ID" use="required"></xs:attribute>
                    </xs:complexType>
                </xs:element>
            </xs:sequence>
        </xs:complexType>
    </xs:element>
</xs:schema>